{
  "artifacts": {
    "metrics": "results/sample/ga/2026/06/sample-ga-20260622-000000-3f8a1d2/metrics.json",
    "solution": "results/sample/ga/2026/06/sample-ga-20260622-000000-3f8a1d2/solution.json",
    "trace": "results/sample/ga/2026/06/sample-ga-20260622-000000-3f8a1d2/trace.json"
  },
  "benchmark_group": "sample",
  "benchmark_id": "sample_tiny_sequence",
  "benchmarks": {
    "commit": "7a91e4f",
    "commit_url": "https://github.com/Dongbox/optagent-benckmarks/commit/7a91e4f"
  },
  "created_at": "2026-06-22T00:00:00Z",
  "environment": {
    "platform": "ubuntu-22.04",
    "python": "3.12.4",
    "runner": "sample"
  },
  "family": "sequence_blackbox_tsp",
  "metrics": {
    "best_cost": 125.2,
    "evaluations_per_s": 1234.5,
    "feasible": true,
    "gap_rel": 0.0433333333,
    "improvement_per_second": 42.1,
    "objective": 125.2,
    "reference_cost": 120.0,
    "runtime_ms": 532,
    "status": "success",
    "time_to_best_ms": 410,
    "time_to_first_feasible_ms": 80
  },
  "optagent": {
    "commit": "3f8a1d2",
    "commit_url": "https://github.com/Dongbox/optagent/commit/3f8a1d2",
    "version": "1.1.0",
    "wheel_sha256": "sha256-sample"
  },
  "run_id": "sample-ga-20260622-000000-3f8a1d2",
  "schema_version": 1,
  "seed": 123,
  "strategy": "ga",
  "strategy_config": {
    "max_iterations": 20,
    "parallel_workers": 1,
    "population_size": 16
  },
  "strategy_profile": "ga_sample_v1",
  "tier": "smoke"
}
